{
  "title": "kgfoundry",
  "synopsis": "Cohesive namespace that exposes the primary KgFoundry subpackages.",
  "module_meta": {
    "owner": "@kgfoundry-core",
    "stability": "experimental",
    "since": "0.0.0"
  },
  "symbols": {
    "docling": {"owner": "@kgfoundry-core", "stability": "experimental", "since": "0.0.0"},
    "download": {"owner": "@kgfoundry-core", "stability": "experimental", "since": "0.0.0"},
    "embeddings_dense": {"owner": "@kgfoundry-core", "stability": "experimental", "since": "0.0.0"},
    "embeddings_sparse": {"owner": "@kgfoundry-core", "stability": "experimental", "since": "0.0.0"},
    "kg_builder": {"owner": "@kgfoundry-core", "stability": "experimental", "since": "0.0.0"},
    "kgfoundry_common": {"owner": "@kgfoundry-core", "stability": "experimental", "since": "0.0.0"},
    "linking": {"owner": "@kgfoundry-core", "stability": "experimental", "since": "0.0.0"},
    "observability": {"owner": "@kgfoundry-core", "stability": "experimental", "since": "0.0.0"},
    "ontology": {"owner": "@kgfoundry-core", "stability": "experimental", "since": "0.0.0"},
    "orchestration": {"owner": "@kgfoundry-core", "stability": "experimental", "since": "0.0.0"},
    "registry": {"owner": "@kgfoundry-core", "stability": "experimental", "since": "0.0.0"},
    "search_api": {"owner": "@kgfoundry-core", "stability": "experimental", "since": "0.0.0"},
    "search_client": {"owner": "@kgfoundry-core", "stability": "experimental", "since": "0.0.0"},
    "vectorstore_faiss": {"owner": "@kgfoundry-core", "stability": "experimental", "since": "0.0.0"}
  }
}

