{
  "title": "kgfoundry_common",
  "synopsis": "Shared utilities and data structures used across KgFoundry services and tools.",
  "module_meta": {
    "owner": "@kgfoundry-common",
    "stability": "stable",
    "since": "0.1.0"
  },
  "symbols": {
    "config": {"owner": "@kgfoundry-common", "stability": "stable", "since": "0.1.0"},
    "errors": {"owner": "@kgfoundry-common", "stability": "stable", "since": "0.1.0"},
    "exceptions": {"owner": "@kgfoundry-common", "stability": "stable", "since": "0.1.0"},
    "fs": {"owner": "@kgfoundry-common", "stability": "stable", "since": "0.1.0"},
    "ids": {"owner": "@kgfoundry-common", "stability": "stable", "since": "0.1.0"},
    "logging": {"owner": "@kgfoundry-common", "stability": "stable", "since": "0.1.0"},
    "models": {"owner": "@kgfoundry-common", "stability": "stable", "since": "0.1.0"},
    "navmap_types": {"owner": "@kgfoundry-common", "stability": "stable", "since": "0.1.0"},
    "observability": {"owner": "@kgfoundry-common", "stability": "stable", "since": "0.1.0"},
    "parquet_io": {"owner": "@kgfoundry-common", "stability": "stable", "since": "0.1.0"},
    "safe_pickle_v2": {"owner": "@kgfoundry-common", "stability": "stable", "since": "0.1.0"},
    "schema_helpers": {"owner": "@kgfoundry-common", "stability": "stable", "since": "0.1.0"},
    "sequence_guards": {"owner": "@kgfoundry-common", "stability": "stable", "since": "0.1.0"},
    "serialization": {"owner": "@kgfoundry-common", "stability": "stable", "since": "0.1.0"},
    "settings": {"owner": "@kgfoundry-common", "stability": "stable", "since": "0.1.0"},
    "subprocess_utils": {"owner": "@kgfoundry-common", "stability": "stable", "since": "0.1.0"},
    "vector_types": {"owner": "@kgfoundry-common", "stability": "stable", "since": "0.1.0"}
  }
}

